No.     Time           Source                Destination           Protocol Length Info
   8455 266.793619000  192.168.0.148         134.0.35.195          ICMP     98     Echo (ping) request  id=0xdf9a, seq=0/0, ttl=64
   8456 267.795356000  192.168.0.148         134.0.35.195          ICMP     98     Echo (ping) request  id=0xdf9a, seq=1/256, ttl=64
   9439 289.845350000  192.168.0.148         134.0.35.195          TCP      78     55442 > http [SYN] Seq=0 Win=65535 Len=0 MSS=1460 WS=16 TSval=350458322 TSecr=0 SACK_PERM=1
   9440 290.151728000  134.0.35.195          192.168.0.148         TCP      74     http > 55442 [SYN, ACK] Seq=0 Ack=1 Win=8192 Len=0 MSS=1460 WS=256 SACK_PERM=1 TSval=721508320 TSecr=350458322
   9441 290.151809000  192.168.0.148         134.0.35.195          TCP      66     55442 > http [ACK] Seq=1 Ack=1 Win=131760 Len=0 TSval=350458627 TSecr=721508320
   9442 290.153061000  192.168.0.148         134.0.35.195          HTTP     617    GET /?gj=gj2 HTTP/1.1 
   9447 290.465218000  134.0.35.195          192.168.0.148         TCP      1514   [TCP segment of a reassembled PDU]
   9448 290.465540000  134.0.35.195          192.168.0.148         TCP      1514   [TCP segment of a reassembled PDU]
   9449 290.465632000  192.168.0.148         134.0.35.195          TCP      66     55442 > http [ACK] Seq=552 Ack=2897 Win=129616 Len=0 TSval=350458938 TSecr=721508350
   9450 290.478690000  192.168.0.148         134.0.35.195          TCP      78     55444 > http [SYN] Seq=0 Win=65535 Len=0 MSS=1460 WS=16 TSval=350458950 TSecr=0 SACK_PERM=1
   9451 290.478691000  192.168.0.148         134.0.35.195          TCP      78     55446 > http [SYN] Seq=0 Win=65535 Len=0 MSS=1460 WS=16 TSval=350458950 TSecr=0 SACK_PERM=1
   9452 290.478691000  192.168.0.148         134.0.35.195          TCP      78     55448 > http [SYN] Seq=0 Win=65535 Len=0 MSS=1460 WS=16 TSval=350458950 TSecr=0 SACK_PERM=1
   9453 290.767072000  134.0.35.195          192.168.0.148         TCP      1514   [TCP segment of a reassembled PDU]
   9454 290.767391000  134.0.35.195          192.168.0.148         TCP      1514   [TCP segment of a reassembled PDU]
   9455 290.767440000  192.168.0.148         134.0.35.195          TCP      66     55442 > http [ACK] Seq=552 Ack=4345 Win=131072 Len=0 TSval=350459236 TSecr=721508382
   9456 290.767759000  134.0.35.195          192.168.0.148         TCP      1514   [TCP segment of a reassembled PDU]
   9457 290.767827000  192.168.0.148         134.0.35.195          TCP      66     55442 > http [ACK] Seq=552 Ack=7241 Win=129616 Len=0 TSval=350459236 TSecr=721508382
   9458 290.768267000  134.0.35.195          192.168.0.148         TCP      1514   [TCP segment of a reassembled PDU]
   9459 290.768332000  192.168.0.148         134.0.35.195          TCP      66     55442 > http [ACK] Seq=552 Ack=8689 Win=129616 Len=0 TSval=350459237 TSecr=721508382
   9460 290.771514000  192.168.0.148         134.0.35.195          TCP      78     55449 > http [SYN] Seq=0 Win=65535 Len=0 MSS=1460 WS=16 TSval=350459240 TSecr=0 SACK_PERM=1
   9461 290.771515000  192.168.0.148         134.0.35.195          TCP      78     55451 > http [SYN] Seq=0 Win=65535 Len=0 MSS=1460 WS=16 TSval=350459240 TSecr=0 SACK_PERM=1
   9462 290.771999000  134.0.35.195          192.168.0.148         TCP      74     http > 55444 [SYN, ACK] Seq=0 Ack=1 Win=8192 Len=0 MSS=1460 WS=256 SACK_PERM=1 TSval=721508383 TSecr=350458950
   9463 290.772043000  192.168.0.148         134.0.35.195          TCP      66     55444 > http [ACK] Seq=1 Ack=1 Win=131760 Len=0 TSval=350459240 TSecr=721508383
   9464 290.772978000  192.168.0.148         134.0.35.195          HTTP     426    GET /js/ajax.js HTTP/1.1 
   9465 290.777851000  134.0.35.195          192.168.0.148         TCP      74     http > 55446 [SYN, ACK] Seq=0 Ack=1 Win=8192 Len=0 MSS=1460 WS=256 SACK_PERM=1 TSval=721508383 TSecr=350458950
   9466 290.777910000  134.0.35.195          192.168.0.148         TCP      74     http > 55448 [SYN, ACK] Seq=0 Ack=1 Win=8192 Len=0 MSS=1460 WS=256 SACK_PERM=1 TSval=721508384 TSecr=350458950
   9467 290.777963000  192.168.0.148         134.0.35.195          TCP      66     55446 > http [ACK] Seq=1 Ack=1 Win=131760 Len=0 TSval=350459245 TSecr=721508383
   9468 290.777985000  192.168.0.148         134.0.35.195          TCP      66     55448 > http [ACK] Seq=1 Ack=1 Win=131760 Len=0 TSval=350459245 TSecr=721508384
   9469 290.779006000  192.168.0.148         134.0.35.195          HTTP     442    GET /js/ajax-dynamic-content.js HTTP/1.1 
   9470 290.779823000  192.168.0.148         134.0.35.195          HTTP     434    GET /virtualpaginate.js HTTP/1.1 
   9471 291.074420000  134.0.35.195          192.168.0.148         TCP      1514   [TCP segment of a reassembled PDU]
   9472 291.074814000  134.0.35.195          192.168.0.148         TCP      1514   [TCP segment of a reassembled PDU]
   9473 291.074908000  192.168.0.148         134.0.35.195          TCP      66     55442 > http [ACK] Seq=552 Ack=11585 Win=128176 Len=0 TSval=350459539 TSecr=721508412
   9474 291.075104000  134.0.35.195          192.168.0.148         TCP      1514   [TCP segment of a reassembled PDU]
   9475 291.075285000  192.168.0.148         134.0.35.195          TCP      66     55442 > http [ACK] Seq=552 Ack=13033 Win=130800 Len=0 TSval=350459539 TSecr=721508412
   9476 291.075640000  134.0.35.195          192.168.0.148         HTTP     1514   Continuation or non-HTTP traffic
   9477 291.075997000  134.0.35.195          192.168.0.148         HTTP     1514   Continuation or non-HTTP traffic
   9478 291.076088000  192.168.0.148         134.0.35.195          TCP      66     55442 > http [ACK] Seq=552 Ack=15929 Win=129616 Len=0 TSval=350459540 TSecr=721508412
   9479 291.076337000  134.0.35.195          192.168.0.148         HTTP     1514   Continuation or non-HTTP traffic
   9480 291.076497000  192.168.0.148         134.0.35.195          TCP      66     55442 > http [ACK] Seq=552 Ack=17377 Win=131072 Len=0 TSval=350459540 TSecr=721508412
   9481 291.076981000  134.0.35.195          192.168.0.148         HTTP     1514   Continuation or non-HTTP traffic
   9482 291.077284000  134.0.35.195          192.168.0.148         TCP      1514   [TCP segment of a reassembled PDU]
   9483 291.078159000  134.0.35.195          192.168.0.148         HTTP     566    HTTP/1.1 200 OK  (application/x-javascript)
   9484 291.078221000  192.168.0.148         134.0.35.195          TCP      66     55448 > http [ACK] Seq=377 Ack=1949 Win=130560 Len=0 TSval=350459542 TSecr=721508413
   9485 291.078525000  134.0.35.195          192.168.0.148         TCP      1514   [TCP segment of a reassembled PDU]
   9486 291.078837000  134.0.35.195          192.168.0.148         TCP      1514   [TCP segment of a reassembled PDU]
   9487 291.078909000  192.168.0.148         134.0.35.195          TCP      66     55444 > http [ACK] Seq=361 Ack=2897 Win=128864 Len=0 TSval=350459542 TSecr=721508413
   9488 291.078965000  192.168.0.148         134.0.35.195          TCP      66     55448 > http [FIN, ACK] Seq=377 Ack=1949 Win=131072 Len=0 TSval=350459542 TSecr=721508413
   9489 291.079165000  134.0.35.195          192.168.0.148         TCP      1514   [TCP segment of a reassembled PDU]
   9490 291.079468000  134.0.35.195          192.168.0.148         TCP      1514   [TCP segment of a reassembled PDU]
   9491 291.079529000  192.168.0.148         134.0.35.195          TCP      66     55446 > http [ACK] Seq=369 Ack=2897 Win=129616 Len=0 TSval=350459543 TSecr=721508413
   9492 291.082040000  192.168.0.148         134.0.35.195          TCP      78     55453 > http [SYN] Seq=0 Win=65535 Len=0 MSS=1460 WS=16 TSval=350459545 TSecr=0 SACK_PERM=1
   9493 291.193987000  192.168.0.148         134.0.35.195          TCP      66     55442 > http [ACK] Seq=552 Ack=18825 Win=131072 Len=0 TSval=350459656 TSecr=721508412
   9494 291.364235000  134.0.35.195          192.168.0.148         HTTP     1514   [TCP Previous segment not captured] Continuation or non-HTTP traffic
   9495 291.364423000  192.168.0.148         134.0.35.195          TCP      78     [TCP Dup ACK 9493#1] 55442 > http [ACK] Seq=552 Ack=18825 Win=131072 Len=0 TSval=350459825 TSecr=721508412 SLE=20273 SRE=21721
   9496 291.364519000  134.0.35.195          192.168.0.148         HTTP     1514   Continuation or non-HTTP traffic
   9497 291.364613000  192.168.0.148         134.0.35.195          TCP      78     [TCP Dup ACK 9493#2] 55442 > http [ACK] Seq=552 Ack=18825 Win=131072 Len=0 TSval=350459825 TSecr=721508412 SLE=20273 SRE=23169
   9498 291.364760000  134.0.35.195          192.168.0.148         HTTP     1514   Continuation or non-HTTP traffic
   9499 291.364818000  192.168.0.148         134.0.35.195          TCP      78     [TCP Dup ACK 9493#3] 55442 > http [ACK] Seq=552 Ack=18825 Win=131072 Len=0 TSval=350459825 TSecr=721508412 SLE=20273 SRE=24617
   9500 291.365062000  134.0.35.195          192.168.0.148         HTTP     1514   Continuation or non-HTTP traffic
   9501 291.365099000  192.168.0.148         134.0.35.195          TCP      78     [TCP Dup ACK 9493#4] 55442 > http [ACK] Seq=552 Ack=18825 Win=131072 Len=0 TSval=350459825 TSecr=721508412 SLE=20273 SRE=26065
   9502 291.366524000  134.0.35.195          192.168.0.148         HTTP     1514   Continuation or non-HTTP traffic
   9503 291.366657000  192.168.0.148         134.0.35.195          TCP      78     [TCP Dup ACK 9493#5] 55442 > http [ACK] Seq=552 Ack=18825 Win=131072 Len=0 TSval=350459827 TSecr=721508412 SLE=20273 SRE=27513
   9504 291.366832000  134.0.35.195          192.168.0.148         HTTP     1514   Continuation or non-HTTP traffic
   9505 291.366968000  192.168.0.148         134.0.35.195          TCP      78     [TCP Dup ACK 9493#6] 55442 > http [ACK] Seq=552 Ack=18825 Win=131072 Len=0 TSval=350459827 TSecr=721508412 SLE=20273 SRE=28961
   9506 291.367170000  134.0.35.195          192.168.0.148         HTTP     1514   Continuation or non-HTTP traffic
   9507 291.367240000  192.168.0.148         134.0.35.195          TCP      78     [TCP Dup ACK 9493#7] 55442 > http [ACK] Seq=552 Ack=18825 Win=131072 Len=0 TSval=350459827 TSecr=721508412 SLE=20273 SRE=30409
   9508 291.367480000  134.0.35.195          192.168.0.148         HTTP     1514   Continuation or non-HTTP traffic
   9509 291.367536000  192.168.0.148         134.0.35.195          TCP      78     [TCP Dup ACK 9493#8] 55442 > http [ACK] Seq=552 Ack=18825 Win=131072 Len=0 TSval=350459827 TSecr=721508412 SLE=20273 SRE=31857
   9510 291.367780000  134.0.35.195          192.168.0.148         HTTP     1514   Continuation or non-HTTP traffic
   9511 291.367817000  192.168.0.148         134.0.35.195          TCP      78     [TCP Dup ACK 9493#9] 55442 > http [ACK] Seq=552 Ack=18825 Win=131072 Len=0 TSval=350459828 TSecr=721508412 SLE=20273 SRE=33305
   9512 291.368092000  134.0.35.195          192.168.0.148         HTTP     1514   Continuation or non-HTTP traffic
   9513 291.368132000  192.168.0.148         134.0.35.195          TCP      78     [TCP Dup ACK 9493#10] 55442 > http [ACK] Seq=552 Ack=18825 Win=131072 Len=0 TSval=350459828 TSecr=721508412 SLE=20273 SRE=34753
   9514 291.368560000  134.0.35.195          192.168.0.148         HTTP     1514   Continuation or non-HTTP traffic
   9515 291.368609000  192.168.0.148         134.0.35.195          TCP      78     [TCP Dup ACK 9493#11] 55442 > http [ACK] Seq=552 Ack=18825 Win=131072 Len=0 TSval=350459828 TSecr=721508412 SLE=20273 SRE=36201
   9516 291.368863000  134.0.35.195          192.168.0.148         HTTP     1514   Continuation or non-HTTP traffic
   9517 291.368924000  192.168.0.148         134.0.35.195          TCP      78     [TCP Dup ACK 9493#12] 55442 > http [ACK] Seq=552 Ack=18825 Win=131072 Len=0 TSval=350459829 TSecr=721508412 SLE=20273 SRE=37649
   9518 291.370706000  134.0.35.195          192.168.0.148         TCP      1514   [TCP segment of a reassembled PDU]
   9519 291.370881000  192.168.0.148         134.0.35.195          TCP      66     55446 > http [ACK] Seq=369 Ack=4345 Win=131072 Len=0 TSval=350459830 TSecr=721508443
   9520 291.371031000  134.0.35.195          192.168.0.148         TCP      1514   [TCP segment of a reassembled PDU]
   9521 291.371344000  134.0.35.195          192.168.0.148         TCP      1514   [TCP segment of a reassembled PDU]
   9522 291.371397000  192.168.0.148         134.0.35.195          TCP      66     55446 > http [ACK] Seq=369 Ack=7241 Win=129616 Len=0 TSval=350459830 TSecr=721508443
   9523 291.371663000  134.0.35.195          192.168.0.148         TCP      1514   [TCP segment of a reassembled PDU]
   9524 291.371714000  192.168.0.148         134.0.35.195          TCP      66     55446 > http [ACK] Seq=369 Ack=8689 Win=129616 Len=0 TSval=350459830 TSecr=721508443
   9525 291.371981000  134.0.35.195          192.168.0.148         HTTP     1450   HTTP/1.1 200 OK  (application/x-javascript)
   9526 291.372046000  134.0.35.195          192.168.0.148         TCP      66     http > 55448 [FIN, ACK] Seq=1949 Ack=377 Win=66560 Len=0 TSval=721508443 TSecr=350459542
   9527 291.372058000  192.168.0.148         134.0.35.195          TCP      66     55444 > http [ACK] Seq=361 Ack=4281 Win=129680 Len=0 TSval=350459831 TSecr=721508443
   9528 291.372139000  134.0.35.195          192.168.0.148         TCP      66     http > 55448 [ACK] Seq=1950 Ack=378 Win=66560 Len=0 TSval=721508443 TSecr=350459542
   9529 291.372153000  192.168.0.148         134.0.35.195          TCP      66     55448 > http [FIN, ACK] Seq=377 Ack=1950 Win=131072 Len=0 TSval=350459831 TSecr=721508443
   9530 291.372192000  192.168.0.148         134.0.35.195          TCP      66     [TCP Dup ACK 9529#1] 55448 > http [ACK] Seq=378 Ack=1950 Win=131072 Len=0 TSval=350459831 TSecr=721508443
   9531 291.372829000  192.168.0.148         134.0.35.195          TCP      66     55444 > http [FIN, ACK] Seq=361 Ack=4281 Win=131072 Len=0 TSval=350459831 TSecr=721508443
   9532 291.373382000  134.0.35.195          192.168.0.148         TCP      74     http > 55453 [SYN, ACK] Seq=0 Ack=1 Win=8192 Len=0 MSS=1460 WS=256 SACK_PERM=1 TSval=721508443 TSecr=350459545
   9533 291.373442000  192.168.0.148         134.0.35.195          TCP      66     55453 > http [ACK] Seq=1 Ack=1 Win=131760 Len=0 TSval=350459832 TSecr=721508443
   9534 291.375055000  192.168.0.148         134.0.35.195          HTTP     450    GET /image-slideshow.css HTTP/1.1 
   9535 291.376057000  192.168.0.148         134.0.35.195          TCP      78     55455 > http [SYN] Seq=0 Win=65535 Len=0 MSS=1460 WS=16 TSval=350459835 TSecr=0 SACK_PERM=1
   9537 291.483357000  134.0.35.195          192.168.0.148         HTTP     1514   Continuation or non-HTTP traffic
   9538 291.483448000  192.168.0.148         134.0.35.195          TCP      78     [TCP Dup ACK 9493#13] 55442 > http [ACK] Seq=552 Ack=18825 Win=131072 Len=0 TSval=350459941 TSecr=721508412 SLE=20273 SRE=39097
   9539 291.483626000  134.0.35.195          192.168.0.148         HTTP     1514   Continuation or non-HTTP traffic
   9540 291.483674000  192.168.0.148         134.0.35.195          TCP      78     [TCP Dup ACK 9493#14] 55442 > http [ACK] Seq=552 Ack=18825 Win=131072 Len=0 TSval=350459941 TSecr=721508412 SLE=20273 SRE=40545
   9541 291.656647000  134.0.35.195          192.168.0.148         HTTP     1514   [TCP Retransmission] Continuation or non-HTTP traffic
   9542 291.656757000  192.168.0.148         134.0.35.195          TCP      66     55442 > http [ACK] Seq=552 Ack=40545 Win=109344 Len=0 TSval=350460113 TSecr=721508472
   9543 291.661713000  134.0.35.195          192.168.0.148         HTTP     486    HTTP/1.1 200 OK  (application/x-javascript)
   9544 291.661792000  192.168.0.148         134.0.35.195          TCP      66     55446 > http [ACK] Seq=369 Ack=9109 Win=130640 Len=0 TSval=350460118 TSecr=721508472
   9545 291.662303000  192.168.0.148         134.0.35.195          TCP      66     55446 > http [FIN, ACK] Seq=369 Ack=9109 Win=131072 Len=0 TSval=350460118 TSecr=721508472
   9546 291.663704000  134.0.35.195          192.168.0.148         TCP      66     http > 55444 [FIN, ACK] Seq=4281 Ack=361 Win=66560 Len=0 TSval=721508472 TSecr=350459831
   9547 291.663756000  192.168.0.148         134.0.35.195          TCP      66     55444 > http [FIN, ACK] Seq=361 Ack=4282 Win=131072 Len=0 TSval=350460119 TSecr=721508472
   9548 291.664151000  134.0.35.195          192.168.0.148         TCP      66     http > 55444 [ACK] Seq=4282 Ack=362 Win=66560 Len=0 TSval=721508473 TSecr=350459831
   9549 291.664195000  192.168.0.148         134.0.35.195          TCP      66     [TCP Dup ACK 9547#1] 55444 > http [ACK] Seq=362 Ack=4282 Win=131072 Len=0 TSval=350460119 TSecr=721508473
   9550 291.664700000  192.168.0.148         134.0.35.195          TCP      78     55457 > http [SYN] Seq=0 Win=65535 Len=0 MSS=1460 WS=16 TSval=350460119 TSecr=0 SACK_PERM=1
   9551 291.668170000  134.0.35.195          192.168.0.148         TCP      74     http > 55455 [SYN, ACK] Seq=0 Ack=1 Win=8192 Len=0 MSS=1460 WS=256 SACK_PERM=1 TSval=721508473 TSecr=350459835
   9552 291.668243000  192.168.0.148         134.0.35.195          TCP      66     55455 > http [ACK] Seq=1 Ack=1 Win=131760 Len=0 TSval=350460123 TSecr=721508473
   9553 291.668832000  134.0.35.195          192.168.0.148         TCP      1514   [TCP segment of a reassembled PDU]
   9554 291.669002000  134.0.35.195          192.168.0.148         HTTP     605    HTTP/1.1 200 OK  (text/css)
   9555 291.669042000  192.168.0.148         134.0.35.195          TCP      66     55453 > http [ACK] Seq=385 Ack=1988 Win=129776 Len=0 TSval=350460123 TSecr=721508473
   9556 291.669389000  192.168.0.148         134.0.35.195          HTTP     448    GET /galeri_styles.css HTTP/1.1 
   9557 291.670170000  192.168.0.148         134.0.35.195          TCP      66     55453 > http [FIN, ACK] Seq=385 Ack=1988 Win=131072 Len=0 TSval=350460124 TSecr=721508473
   9558 291.797231000  192.168.0.148         134.0.35.195          TCP      78     55451 > http [SYN] Seq=0 Win=65535 Len=0 MSS=1460 WS=16 TSval=350460250 TSecr=0 SACK_PERM=1
   9559 291.797231000  192.168.0.148         134.0.35.195          TCP      78     55449 > http [SYN] Seq=0 Win=65535 Len=0 MSS=1460 WS=16 TSval=350460250 TSecr=0 SACK_PERM=1
   9560 291.945623000  134.0.35.195          192.168.0.148         HTTP     1183   Continuation or non-HTTP traffic
   9561 291.945875000  192.168.0.148         134.0.35.195          TCP      66     55442 > http [ACK] Seq=552 Ack=41662 Win=129952 Len=0 TSval=350460398 TSecr=721508501
   9562 291.947080000  192.168.0.148         134.0.35.195          TCP      66     55442 > http [FIN, ACK] Seq=552 Ack=41662 Win=131072 Len=0 TSval=350460399 TSecr=721508501
   9563 291.950847000  134.0.35.195          192.168.0.148         TCP      66     http > 55446 [FIN, ACK] Seq=9109 Ack=369 Win=66560 Len=0 TSval=721508501 TSecr=350460118
   9564 291.950980000  192.168.0.148         134.0.35.195          TCP      66     55446 > http [FIN, ACK] Seq=369 Ack=9110 Win=131072 Len=0 TSval=350460402 TSecr=721508501
   9565 291.951215000  134.0.35.195          192.168.0.148         TCP      66     http > 55446 [ACK] Seq=9110 Ack=370 Win=66560 Len=0 TSval=721508501 TSecr=350460118
   9566 291.951360000  192.168.0.148         134.0.35.195          TCP      66     [TCP Dup ACK 9564#1] 55446 > http [ACK] Seq=370 Ack=9110 Win=131072 Len=0 TSval=350460402 TSecr=721508501
   9567 291.957266000  134.0.35.195          192.168.0.148         TCP      74     http > 55457 [SYN, ACK] Seq=0 Ack=1 Win=8192 Len=0 MSS=1460 WS=256 SACK_PERM=1 TSval=721508502 TSecr=350460119
   9568 291.957336000  134.0.35.195          192.168.0.148         TCP      66     http > 55453 [FIN, ACK] Seq=1988 Ack=385 Win=66560 Len=0 TSval=721508502 TSecr=350460123
   9569 291.957404000  192.168.0.148         134.0.35.195          TCP      66     55457 > http [ACK] Seq=1 Ack=1 Win=131760 Len=0 TSval=350460408 TSecr=721508502
   9570 291.957428000  192.168.0.148         134.0.35.195          TCP      66     55453 > http [FIN, ACK] Seq=385 Ack=1989 Win=131072 Len=0 TSval=350460408 TSecr=721508502
   9571 291.958182000  134.0.35.195          192.168.0.148         TCP      66     http > 55453 [ACK] Seq=1989 Ack=386 Win=66560 Len=0 TSval=721508502 TSecr=350460124
   9572 291.958246000  192.168.0.148         134.0.35.195          TCP      66     [TCP Dup ACK 9570#1] 55453 > http [ACK] Seq=386 Ack=1989 Win=131072 Len=0 TSval=350460408 TSecr=721508502
   9573 291.958833000  192.168.0.148         134.0.35.195          HTTP     427    GET /ocscript.js HTTP/1.1 
   9574 291.962543000  134.0.35.195          192.168.0.148         HTTP     1346   HTTP/1.1 200 OK  (text/css)
   9575 291.962747000  192.168.0.148         134.0.35.195          TCP      66     55455 > http [ACK] Seq=383 Ack=1281 Win=130480 Len=0 TSval=350460412 TSecr=721508502
   9576 291.963595000  192.168.0.148         134.0.35.195          TCP      66     55455 > http [FIN, ACK] Seq=383 Ack=1281 Win=131072 Len=0 TSval=350460412 TSecr=721508502
   9578 292.234357000  134.0.35.195          192.168.0.148         TCP      66     http > 55442 [FIN, ACK] Seq=41662 Ack=552 Win=66560 Len=0 TSval=721508530 TSecr=350460398
   9579 292.234618000  192.168.0.148         134.0.35.195          TCP      66     55442 > http [FIN, ACK] Seq=552 Ack=41663 Win=131072 Len=0 TSval=350460683 TSecr=721508530
   9580 292.235747000  134.0.35.195          192.168.0.148         TCP      66     http > 55442 [ACK] Seq=41663 Ack=553 Win=66560 Len=0 TSval=721508530 TSecr=350460399
   9581 292.235922000  192.168.0.148         134.0.35.195          TCP      66     [TCP Dup ACK 9579#1] 55442 > http [ACK] Seq=553 Ack=41663 Win=131072 Len=0 TSval=350460684 TSecr=721508530
   9582 292.251744000  134.0.35.195          192.168.0.148         TCP      66     http > 55455 [ACK] Seq=1281 Ack=384 Win=66560 Len=0 TSval=721508531 TSecr=350460412
   9583 292.252029000  192.168.0.148         134.0.35.195          TCP      66     [TCP Dup ACK 9576#1] 55455 > http [ACK] Seq=384 Ack=1281 Win=131072 Len=0 TSval=350460700 TSecr=721508531
   9584 292.252832000  134.0.35.195          192.168.0.148         TCP      66     http > 55455 [FIN, ACK] Seq=1281 Ack=384 Win=66560 Len=0 TSval=721508531 TSecr=350460412
   9585 292.252957000  192.168.0.148         134.0.35.195          TCP      66     55455 > http [ACK] Seq=384 Ack=1282 Win=131072 Len=0 TSval=350460701 TSecr=721508531
   9586 292.257715000  134.0.35.195          192.168.0.148         TCP      1514   [TCP segment of a reassembled PDU]
   9587 292.257980000  134.0.35.195          192.168.0.148         TCP      1514   [TCP segment of a reassembled PDU]
   9588 292.258052000  192.168.0.148         134.0.35.195          TCP      66     55457 > http [ACK] Seq=362 Ack=2897 Win=128864 Len=0 TSval=350460705 TSecr=721508531
   9590 292.612189000  134.0.35.195          192.168.0.148         TCP      1514   [TCP segment of a reassembled PDU]
   9591 292.612464000  134.0.35.195          192.168.0.148         TCP      1514   [TCP segment of a reassembled PDU]
   9592 292.612539000  192.168.0.148         134.0.35.195          TCP      66     55457 > http [ACK] Seq=362 Ack=5793 Win=128176 Len=0 TSval=350461057 TSecr=721508561
   9593 292.612721000  134.0.35.195          192.168.0.148         TCP      1514   [TCP segment of a reassembled PDU]
   9594 292.612908000  192.168.0.148         134.0.35.195          TCP      66     55457 > http [ACK] Seq=362 Ack=7241 Win=131072 Len=0 TSval=350461057 TSecr=721508561
   9595 292.613293000  134.0.35.195          192.168.0.148         TCP      1514   [TCP segment of a reassembled PDU]
   9596 292.613351000  192.168.0.148         134.0.35.195          TCP      66     55457 > http [ACK] Seq=362 Ack=8689 Win=129616 Len=0 TSval=350461058 TSecr=721508561
   9597 292.899772000  192.168.0.148         134.0.35.195          TCP      78     55451 > http [SYN] Seq=0 Win=65535 Len=0 MSS=1460 WS=16 TSval=350461343 TSecr=0 SACK_PERM=1
   9598 292.899773000  192.168.0.148         134.0.35.195          TCP      78     55449 > http [SYN] Seq=0 Win=65535 Len=0 MSS=1460 WS=16 TSval=350461343 TSecr=0 SACK_PERM=1
   9599 292.902222000  134.0.35.195          192.168.0.148         HTTP     486    HTTP/1.1 200 OK  (application/x-javascript)
   9600 292.902393000  192.168.0.148         134.0.35.195          TCP      66     55457 > http [ACK] Seq=362 Ack=9109 Win=130640 Len=0 TSval=350461345 TSecr=721508596
   9601 292.903361000  192.168.0.148         134.0.35.195          TCP      66     55457 > http [FIN, ACK] Seq=362 Ack=9109 Win=131072 Len=0 TSval=350461345 TSecr=721508596
   9602 293.225596000  134.0.35.195          192.168.0.148         TCP      66     http > 55457 [FIN, ACK] Seq=9109 Ack=362 Win=66560 Len=0 TSval=721508625 TSecr=350461345
   9603 293.225654000  134.0.35.195          192.168.0.148         TCP      66     http > 55457 [ACK] Seq=9110 Ack=363 Win=66560 Len=0 TSval=721508625 TSecr=350461345
   9604 293.225683000  192.168.0.148         134.0.35.195          TCP      66     55457 > http [FIN, ACK] Seq=362 Ack=9110 Win=131072 Len=0 TSval=350461667 TSecr=721508625
   9605 293.225701000  192.168.0.148         134.0.35.195          TCP      66     [TCP Dup ACK 9604#1] 55457 > http [ACK] Seq=363 Ack=9110 Win=131072 Len=0 TSval=350461667 TSecr=721508625
   9606 293.904892000  192.168.0.148         134.0.35.195          TCP      78     55451 > http [SYN] Seq=0 Win=65535 Len=0 MSS=1460 WS=16 TSval=350462343 TSecr=0 SACK_PERM=1
   9607 293.904892000  192.168.0.148         134.0.35.195          TCP      78     55449 > http [SYN] Seq=0 Win=65535 Len=0 MSS=1460 WS=16 TSval=350462343 TSecr=0 SACK_PERM=1
   9608 294.063303000  134.0.35.195          192.168.0.148         TCP      74     http > 55449 [SYN, ACK] Seq=0 Ack=1 Win=8192 Len=0 MSS=1460 WS=256 SACK_PERM=1 TSval=721508712 TSecr=350459240
   9609 294.063559000  192.168.0.148         134.0.35.195          TCP      66     55449 > http [ACK] Seq=1 Ack=1 Win=131760 Len=0 TSval=350462500 TSecr=721508712
   9610 294.065728000  192.168.0.148         134.0.35.195          HTTP     441    GET /stilet.css HTTP/1.1 
   9611 294.078120000  134.0.35.195          192.168.0.148         TCP      74     http > 55451 [SYN, ACK] Seq=0 Ack=1 Win=8192 Len=0 MSS=1460 WS=256 SACK_PERM=1 TSval=721508714 TSecr=350459240
   9612 294.078315000  192.168.0.148         134.0.35.195          TCP      66     55451 > http [ACK] Seq=1 Ack=1 Win=131760 Len=0 TSval=350462514 TSecr=721508714
   9613 294.079736000  192.168.0.148         134.0.35.195          HTTP     445    GET /menustyle2.css HTTP/1.1 
   9616 294.458058000  134.0.35.195          192.168.0.148         TCP      1514   [TCP segment of a reassembled PDU]
   9617 294.458384000  134.0.35.195          192.168.0.148         TCP      1514   [TCP segment of a reassembled PDU]
   9618 294.458458000  192.168.0.148         134.0.35.195          TCP      66     55449 > http [ACK] Seq=376 Ack=2897 Win=129616 Len=0 TSval=350462890 TSecr=721508742
   9619 294.458838000  134.0.35.195          192.168.0.148         TCP      1514   [TCP segment of a reassembled PDU]
   9620 294.459323000  134.0.35.195          192.168.0.148         HTTP     1278   HTTP/1.1 200 OK  (text/css)
   9621 294.459396000  192.168.0.148         134.0.35.195          TCP      66     55451 > http [ACK] Seq=380 Ack=2661 Win=129856 Len=0 TSval=350462891 TSecr=721508743
   9622 294.460134000  192.168.0.148         134.0.35.195          TCP      66     55451 > http [FIN, ACK] Seq=380 Ack=2661 Win=131072 Len=0 TSval=350462891 TSecr=721508743
   9624 294.762676000  134.0.35.195          192.168.0.148         TCP      1514   [TCP segment of a reassembled PDU]
   9625 294.762754000  134.0.35.195          192.168.0.148         HTTP     241    HTTP/1.1 200 OK  (text/css)
   9626 294.762864000  134.0.35.195          192.168.0.148         TCP      66     http > 55451 [FIN, ACK] Seq=2661 Ack=380 Win=66560 Len=0 TSval=721508781 TSecr=350462891
   9627 294.762880000  192.168.0.148         134.0.35.195          TCP      66     55449 > http [ACK] Seq=376 Ack=4520 Win=129440 Len=0 TSval=350463192 TSecr=721508781
   9628 294.762906000  192.168.0.148         134.0.35.195          TCP      66     55451 > http [FIN, ACK] Seq=380 Ack=2662 Win=131072 Len=0 TSval=350463192 TSecr=721508781
   9629 294.762951000  134.0.35.195          192.168.0.148         TCP      66     http > 55451 [ACK] Seq=2662 Ack=381 Win=66560 Len=0 TSval=721508781 TSecr=350462891
   9630 294.762991000  192.168.0.148         134.0.35.195          TCP      66     [TCP Dup ACK 9628#1] 55451 > http [ACK] Seq=381 Ack=2662 Win=131072 Len=0 TSval=350463192 TSecr=721508781
   9631 294.763811000  192.168.0.148         134.0.35.195          TCP      66     55449 > http [FIN, ACK] Seq=376 Ack=4520 Win=131072 Len=0 TSval=350463193 TSecr=721508781
   9636 294.835275000  192.168.0.148         134.0.35.195          TCP      78     55459 > http [SYN] Seq=0 Win=65535 Len=0 MSS=1460 WS=16 TSval=350463263 TSecr=0 SACK_PERM=1
   9637 294.835276000  192.168.0.148         134.0.35.195          TCP      78     55461 > http [SYN] Seq=0 Win=65535 Len=0 MSS=1460 WS=16 TSval=350463263 TSecr=0 SACK_PERM=1
   9638 294.835809000  192.168.0.148         134.0.35.195          TCP      78     55462 > http [SYN] Seq=0 Win=65535 Len=0 MSS=1460 WS=16 TSval=350463263 TSecr=0 SACK_PERM=1
   9639 294.835809000  192.168.0.148         134.0.35.195          TCP      78     55464 > http [SYN] Seq=0 Win=65535 Len=0 MSS=1460 WS=16 TSval=350463263 TSecr=0 SACK_PERM=1
   9640 294.835839000  192.168.0.148         134.0.35.195          TCP      78     55465 > http [SYN] Seq=0 Win=65535 Len=0 MSS=1460 WS=16 TSval=350463263 TSecr=0 SACK_PERM=1
   9641 294.835959000  192.168.0.148         134.0.35.195          TCP      78     55466 > http [SYN] Seq=0 Win=65535 Len=0 MSS=1460 WS=16 TSval=350463263 TSecr=0 SACK_PERM=1
   9642 295.052603000  134.0.35.195          192.168.0.148         TCP      66     http > 55449 [FIN, ACK] Seq=4520 Ack=376 Win=66560 Len=0 TSval=721508811 TSecr=350463192
   9643 295.052815000  192.168.0.148         134.0.35.195          TCP      66     55449 > http [FIN, ACK] Seq=376 Ack=4521 Win=131072 Len=0 TSval=350463479 TSecr=721508811
   9644 295.052934000  134.0.35.195          192.168.0.148         TCP      66     http > 55449 [ACK] Seq=4521 Ack=377 Win=66560 Len=0 TSval=721508811 TSecr=350463193
   9645 295.053168000  192.168.0.148         134.0.35.195          TCP      66     [TCP Dup ACK 9643#1] 55449 > http [ACK] Seq=377 Ack=4521 Win=131072 Len=0 TSval=350463479 TSecr=721508811
   9647 295.146211000  134.0.35.195          192.168.0.148         TCP      74     http > 55459 [SYN, ACK] Seq=0 Ack=1 Win=8192 Len=0 MSS=1460 WS=256 SACK_PERM=1 TSval=721508820 TSecr=350463263
   9648 295.146481000  192.168.0.148         134.0.35.195          TCP      66     55459 > http [ACK] Seq=1 Ack=1 Win=131760 Len=0 TSval=350463571 TSecr=721508820
   9649 295.148849000  192.168.0.148         134.0.35.195          HTTP     434    GET /imazhet/kokaen.jpg HTTP/1.1 
   9650 295.149670000  134.0.35.195          192.168.0.148         TCP      74     http > 55461 [SYN, ACK] Seq=0 Ack=1 Win=8192 Len=0 MSS=1460 WS=256 SACK_PERM=1 TSval=721508821 TSecr=350463263
   9651 295.149735000  192.168.0.148         134.0.35.195          TCP      66     55461 > http [ACK] Seq=1 Ack=1 Win=131760 Len=0 TSval=350463573 TSecr=721508821
   9652 295.151366000  134.0.35.195          192.168.0.148         TCP      74     http > 55462 [SYN, ACK] Seq=0 Ack=1 Win=8192 Len=0 MSS=1460 WS=256 SACK_PERM=1 TSval=721508821 TSecr=350463263
   9653 295.151391000  192.168.0.148         134.0.35.195          HTTP     448    GET /imazhet/imazhet/albania_flag.gif HTTP/1.1 
   9654 295.151447000  192.168.0.148         134.0.35.195          TCP      66     55462 > http [ACK] Seq=1 Ack=1 Win=131760 Len=0 TSval=350463575 TSecr=721508821
   9655 295.152730000  192.168.0.148         134.0.35.195          HTTP     435    GET /imazhet/bg_menu.gif HTTP/1.1 
   9656 295.154270000  134.0.35.195          192.168.0.148         TCP      74     http > 55464 [SYN, ACK] Seq=0 Ack=1 Win=8192 Len=0 MSS=1460 WS=256 SACK_PERM=1 TSval=721508821 TSecr=350463263
   9657 295.154461000  192.168.0.148         134.0.35.195          TCP      66     55464 > http [ACK] Seq=1 Ack=1 Win=131760 Len=0 TSval=350463577 TSecr=721508821
   9658 295.155934000  192.168.0.148         134.0.35.195          HTTP     434    GET /imazhet/bg_doc.gif HTTP/1.1 
   9659 295.156865000  134.0.35.195          192.168.0.148         TCP      74     http > 55465 [SYN, ACK] Seq=0 Ack=1 Win=8192 Len=0 MSS=1460 WS=256 SACK_PERM=1 TSval=721508822 TSecr=350463263
   9660 295.157014000  192.168.0.148         134.0.35.195          TCP      66     55465 > http [ACK] Seq=1 Ack=1 Win=131760 Len=0 TSval=350463579 TSecr=721508822
   9661 295.158160000  192.168.0.148         134.0.35.195          HTTP     435    GET /images/heading3.gif HTTP/1.1 
   9662 295.159567000  134.0.35.195          192.168.0.148         TCP      74     http > 55466 [SYN, ACK] Seq=0 Ack=1 Win=8192 Len=0 MSS=1460 WS=256 SACK_PERM=1 TSval=721508822 TSecr=350463263
   9663 295.159761000  192.168.0.148         134.0.35.195          TCP      66     55466 > http [ACK] Seq=1 Ack=1 Win=131760 Len=0 TSval=350463581 TSecr=721508822
   9664 295.161197000  192.168.0.148         134.0.35.195          HTTP     448    GET /imazhet/imazhet/kryeministri.jpg HTTP/1.1 
   9665 295.684776000  134.0.35.195          192.168.0.148         TCP      1514   [TCP segment of a reassembled PDU]
   9666 295.685212000  134.0.35.195          192.168.0.148         TCP      1514   [TCP segment of a reassembled PDU]
   9667 295.685263000  192.168.0.148         134.0.35.195          TCP      66     55459 > http [ACK] Seq=369 Ack=2897 Win=129616 Len=0 TSval=350464102 TSecr=721508850
   9668 295.685376000  134.0.35.195          192.168.0.148         HTTP     614    HTTP/1.1 200 OK  (GIF89a) (GIF89a) (image/gif)
   9669 295.685413000  192.168.0.148         134.0.35.195          TCP      66     55461 > http [ACK] Seq=383 Ack=549 Win=131216 Len=0 TSval=350464102 TSecr=721508851
   9670 295.685537000  134.0.35.195          192.168.0.148         HTTP     492    HTTP/1.1 200 OK  (GIF89a) (GIF89a) (image/gif)
   9671 295.685573000  192.168.0.148         134.0.35.195          TCP      66     55462 > http [ACK] Seq=370 Ack=427 Win=131328 Len=0 TSval=350464102 TSecr=721508851
   9672 295.685712000  134.0.35.195          192.168.0.148         HTTP     487    HTTP/1.1 200 OK  (GIF89a) (GIF89a) (image/gif)
   9673 295.685748000  192.168.0.148         134.0.35.195          TCP      66     55464 > http [ACK] Seq=369 Ack=422 Win=131344 Len=0 TSval=350464102 TSecr=721508851
   9674 295.685887000  134.0.35.195          192.168.0.148         HTTP     536    HTTP/1.1 404 Not Found  (text/html)
   9675 295.685922000  192.168.0.148         134.0.35.195          TCP      66     55465 > http [ACK] Seq=370 Ack=471 Win=131296 Len=0 TSval=350464103 TSecr=721508851
   9676 295.686568000  192.168.0.148         134.0.35.195          TCP      66     55462 > http [FIN, ACK] Seq=370 Ack=427 Win=131328 Len=0 TSval=350464103 TSecr=721508851
   9677 295.686691000  134.0.35.195          192.168.0.148         TCP      1514   [TCP segment of a reassembled PDU]
   9678 295.687050000  134.0.35.195          192.168.0.148         TCP      1514   [TCP segment of a reassembled PDU]
   9679 295.687090000  192.168.0.148         134.0.35.195          TCP      66     55466 > http [ACK] Seq=383 Ack=2897 Win=129616 Len=0 TSval=350464104 TSecr=721508851
   9680 295.688303000  192.168.0.148         134.0.35.195          TCP      66     55465 > http [FIN, ACK] Seq=370 Ack=471 Win=131296 Len=0 TSval=350464105 TSecr=721508851
   9681 295.688902000  192.168.0.148         134.0.35.195          TCP      66     55461 > http [FIN, ACK] Seq=383 Ack=549 Win=131216 Len=0 TSval=350464105 TSecr=721508851
   9682 295.689676000  192.168.0.148         134.0.35.195          TCP      66     55464 > http [FIN, ACK] Seq=369 Ack=422 Win=131344 Len=0 TSval=350464106 TSecr=721508851
   9683 295.702126000  192.168.0.148         134.0.35.195          TCP      78     55468 > http [SYN] Seq=0 Win=65535 Len=0 MSS=1460 WS=16 TSval=350464118 TSecr=0 SACK_PERM=1
   9684 295.702198000  192.168.0.148         134.0.35.195          TCP      78     55470 > http [SYN] Seq=0 Win=65535 Len=0 MSS=1460 WS=16 TSval=350464118 TSecr=0 SACK_PERM=1
   9685 295.702330000  192.168.0.148         134.0.35.195          TCP      78     55472 > http [SYN] Seq=0 Win=65535 Len=0 MSS=1460 WS=16 TSval=350464118 TSecr=0 SACK_PERM=1
   9686 295.702347000  192.168.0.148         134.0.35.195          TCP      78     55474 > http [SYN] Seq=0 Win=65535 Len=0 MSS=1460 WS=16 TSval=350464118 TSecr=0 SACK_PERM=1
   9695 295.979000000  134.0.35.195          192.168.0.148         TCP      1514   [TCP segment of a reassembled PDU]
   9696 295.979295000  134.0.35.195          192.168.0.148         TCP      1514   [TCP segment of a reassembled PDU]
   9697 295.979383000  192.168.0.148         134.0.35.195          TCP      66     55459 > http [ACK] Seq=369 Ack=5793 Win=128176 Len=0 TSval=350464392 TSecr=721508903
   9698 295.979491000  134.0.35.195          192.168.0.148         TCP      1514   [TCP segment of a reassembled PDU]
   9699 295.979642000  192.168.0.148         134.0.35.195          TCP      66     55459 > http [ACK] Seq=369 Ack=7241 Win=131072 Len=0 TSval=350464392 TSecr=721508903
   9700 295.979807000  134.0.35.195          192.168.0.148         TCP      1514   [TCP segment of a reassembled PDU]
   9701 295.979870000  134.0.35.195          192.168.0.148         TCP      66     http > 55462 [FIN, ACK] Seq=427 Ack=370 Win=66560 Len=0 TSval=721508904 TSecr=350464102
   9702 295.979880000  192.168.0.148         134.0.35.195          TCP      66     55459 > http [ACK] Seq=369 Ack=8689 Win=129616 Len=0 TSval=350464392 TSecr=721508903
   9703 295.979912000  192.168.0.148         134.0.35.195          TCP      66     55462 > http [FIN, ACK] Seq=370 Ack=428 Win=131328 Len=0 TSval=350464392 TSecr=721508904
   9704 295.979975000  134.0.35.195          192.168.0.148         TCP      66     http > 55461 [FIN, ACK] Seq=549 Ack=383 Win=66560 Len=0 TSval=721508904 TSecr=350464102
   9705 295.980070000  134.0.35.195          192.168.0.148         TCP      66     http > 55464 [FIN, ACK] Seq=422 Ack=369 Win=66560 Len=0 TSval=721508904 TSecr=350464102
   9706 295.980082000  192.168.0.148         134.0.35.195          TCP      66     55461 > http [FIN, ACK] Seq=383 Ack=550 Win=131216 Len=0 TSval=350464392 TSecr=721508904
   9707 295.980125000  192.168.0.148         134.0.35.195          TCP      66     55464 > http [FIN, ACK] Seq=369 Ack=423 Win=131344 Len=0 TSval=350464392 TSecr=721508904
   9708 295.980195000  134.0.35.195          192.168.0.148         TCP      66     http > 55465 [FIN, ACK] Seq=471 Ack=370 Win=66560 Len=0 TSval=721508904 TSecr=350464103
   9709 295.980268000  192.168.0.148         134.0.35.195          TCP      66     55465 > http [FIN, ACK] Seq=370 Ack=472 Win=131296 Len=0 TSval=350464393 TSecr=721508904
   9710 295.980712000  134.0.35.195          192.168.0.148         TCP      66     http > 55462 [ACK] Seq=428 Ack=371 Win=66560 Len=0 TSval=721508904 TSecr=350464103
   9711 295.980793000  134.0.35.195          192.168.0.148         TCP      66     http > 55465 [ACK] Seq=472 Ack=371 Win=66560 Len=0 TSval=721508904 TSecr=350464105
   9712 295.980806000  192.168.0.148         134.0.35.195          TCP      66     [TCP Dup ACK 9703#1] 55462 > http [ACK] Seq=371 Ack=428 Win=131328 Len=0 TSval=350464393 TSecr=721508904
